Title,Lyrics,singer,Genre,Writer,Music,metaphors,meaning
Asata Asuwana |  ඇසට අසුවන,"ඇසට අසුවන මායිමේ 
බඹර සැණකෙළි මල් විලේ 
ලසෝ ලැව් ගිනි ඇව්ලුනා සිත 
ඔබ මගෙන් වෙන් වූ දිනේ 
සියපතක් මත විසුල පිණි කැට 
සැඩ සුළං වැද සර සරින් හෙත
මගෙන් රිදවුම් දෙවුණු මොහොතක
ඔබේ වත මට නැගෙයි සිහියට
සතර අත පෙති විහිද විකසිත
මලේ මල් මී මමණයුරු දැක
ඔබේ ලවනත සැදුන මීවිත 
මත් කලා මතකයි මගේ සිත
",කරුණාරත්න දිවුල්ගනේ,නව පොප්,ගුණදාස කපුගේ,මහින්ද දිසානායක,"සියපතක් මත විසුල පිණි කැට 







","කොළයක් මත වැලි කැට විසිරීම






"
Atheethaya Sihinayak | අතීතය සිහිනයක් පමණයි,"අතීතය සිහිනයක් පමණයි 
සැබෑ සුවඳක් නැ
එදා සෙනෙහෙන් නොබැදුනානම් 
මෙදා වියොවක් නැ
තැනූ මන්දිර බිදී වැටුනත් 
නෙතේ කදුලක් නැ
සිනහවෙන්නට වරම් නොලදත් 
හිතේ කිළුටක් නැ
සොබා දහමට නොවන අවනත 
ලොවේ කිසිවක් නැ
ලොවේ පැරදුම මිසක කිසිදා
ලැබූ දිනුමක් නැ
",කරුණාරත්න දිවුල්ගනේ,සම්භාව්ය,නාලක අංජන කුමාර,පෙලෙග්හි හම්රාතාහි හෝමි,"සිනහවෙන්නට වරම් නොලදත් 




","ඔබ සිනාසීමට පවා එඩිතර නොවූවත්




"
Dura Atha Wuwada | දුර ඈත වුවද,"දුර ඈත වුවද ගතිනා
ලඟ පාත නොවෙද සිතිනා
ඇලපාත මුදලි මං
මද හාස නගන් ගජමන් නෝනා
පුන්සඳ ලෙද කළුවර යහනේ
පුන්සිසිවත කඳුළින් තෙමුනේ
තහනම් ද සතුට ලදුනේ
මේ දුකද සැපයි  නුඹෙ හිතට කැපයි
මද හාස නගන් ගජමන් නෝනා
රන් රස සේ ගැලපෙන සේමා
දුන් රස කව් රස විද බෝමා
නොබැදෙම් ද පෙමින් කෝමා
අමනාප කිමැයි  උදහාස කිමැයි
මද හාස නගන් ගජමන් නෝනා
",කරුණාරත්න දිවුල්ගනේ,සම්භාව්ය,රෝහණ වීරසිංහ,පිරිමි මාලනී පෙරේරා,"ලඟ පාත නොවෙද සිතිනා





","මම හිතුවේ නැහැ ඔවුන් සමීපයි කියලා




"
Dura Kathara Gewagena | දුර කතර ගෙවාගෙන,"දුර කතර ගෙවාගෙන
මම නොකියම ආවට
මට සමාවෙයන් බණ්ඩර මැණිකේ
අර බලන්න අර පුර හඳ අහසේ
දුම් වලාකුළෙන් තරුකැට හැංගිලා
නෙත් කොණින් බලා මට ඉඟි බිඟි කළා
මට ඉන්නට බෑ කොළොම්තොටට වෙලා
උඹෙ කතා කරන දෑස මතක් වෙලා
මහා මැදුරු උඩින් පුර හඳ පායලා
නුඹෙ මුහුණ පෙනුණේ මුළු අහසම පුරා
ඒ සෙනෙහෙවන්ත කමට වහල් වෙලා
මට ගම නෑවිත් ඉන්නට බැරිවුණා
",කරුණාරත්න දිවුල්ගනේ,නව පොප්,එච්.එම් ජයවර්ධන,රත්න ශ්‍රී විජේසිංහ,"






අර බලන්න අර පුර හඳ අහසේ

දුම් වලාකුළෙන් තරුකැට හැංගිලා

නෙත් කොණින් බලා මට ඉඟි බිඟි කළා

මට ඉන්නට බෑ කොළොම්තොටට වෙලා

උඹෙ කතා කරන දෑස මතක් වෙලා

මහා මැදුරු උඩින් පුර හඳ පායලා

නුඹෙ මුහුණ පෙනුණේ මුළු අහසම පුරා




","






අහසේ ඇති මේ පූර්ණ චන්ද්‍රයා දෙස බලන්න

දුම් වලාවෙන් තරු සැඟවී ඇත

ඔහුගේ ඇස අගින් ඔහු මට ඉඟි ලබා දුන්නේය

මට කොළඹ ඉන්න බෑ

මට මතකයි ඔයාගේ ඇස් කතා කරනවා

පූර්ණ චන්ද්‍රයා මහා මද්‍රු මතින් බබළයි

ඔබේ මුහුණ අහසේ දිස් විය




"
Gahaka Mal Pipila | ගහක මල් පිපිලා,"ගහක මල් පිපිලා පිපෙන්නේ ඇයිද නොදන්නෙමී
හිතක මල් පිපිලා පිපෙන්නේ ඇයිද නොදන්නෙමී
නුඹට සිත බැඳුනේ කිමැයිමා තවම නොදන්නෙමි
නුඹට සිත බැදි කාරණේ මා තවම සොයන්නෙමී
කතරෙ වැලි කැට හිරුට පෙම්බැද
ඇතත් ලෝ දහමින්
සොදුරු වැස්සට දැවෙන කතරත්
ආදරෙයි පණමෙන්
ලොවට නොපෙනෙන අරුම සෙනෙහස 
ඒ වගෙයි මනරම් කරනුබැරි තහනම්
සදට සදහට සෙනෙහෙ පෑමුත් 
උදුල තරු කැටයම්
හිරුටපෙම් බැදි එකම තරුවක්
සිටිය නොහැකිද යම්
නුඹට නොහැගෙන මගේ ප්රේුමය
ඒ වගේ මනරම් පුදුමවෙයි නුඹ නම්
",කරුණාරත්න දිවුල්ගනේ,නව පොප්,ගුණදාස කපුගේ,පිරිමි මාලනී පෙරේරා,"


හිතක මල් පිපිලා පිපෙන්නේ ඇයිද නොදන්නෙමී

නුඹට සිත බැඳුනේ කිමැයිමා තවම නොදන්නෙමි

නුඹට සිත බැදි කාරණේ මා තවම සොයන්නෙමී

ලොවට නොපෙනෙන අරුම සෙනෙහස 

ඒ වගෙයි මනරම් කරනුබැරි තහනම්




","


මගේ හදවතේ මල් පිපෙන්නේ ඇයිදැයි මම නොදනිමි

ඔබ ආදරය කරන්නේ කාටදැයි මමවත් නොදනිමි

මම තාමත් හොයනවා මම ඔයාට ආදරේ කරන්න හේතුව

ලෝකයට නොපෙනෙන අමුතු සෙනෙහස

එවැනි ලස්සන පුද්ගලයෙකු වීම තහනම්ය




"
Gamata Kalin Hiru | ගමට කලින් හිරු ,"ගමට කලින් හිරු මුළුතැන්ගෙට වඩනා
ඒ හිරු එළියේ නැණ මල් පොඩි පිපුණා
ඒ මල් සුවඳේ අද ලොව්තුරු සුව විඳිනා
කලා වැවේ නිල් දියවර අපෙ අම්මා
රෑ කළුවර අරගෙන දරුවන් එනතුරු
සිත නෑ නිවන් දකින්නේ
රෑ කළුවර ඇවිදින් ඉකිබිඳ හැඬුවත්
නෙත නෑ නිදි විඳගන්නේ
හෙට අරුණට සැරසෙන තව දවසක් ගැන
නින්දේ හීන දකින්නේ
මහමායාවනි කවදාදෝ ඔය නෙත්
දරු සෙනෙහසින් මිදින්නේ
වෙල් දෙනිවල ඇවිදින දෙපා රිදෙන විට
විහඟ ගීත බණ පද වේවා
බෝ මලුවක ඇවිලෙන පහන් වැටක් සේ
තුන් සිත නිවී සැදේවා
මතු උපදින සසරේ විශාඛාව වී 
මෙත් මඟ නෙත් හමුවේවා
ඇත් රැජිනියනේ ඔබෙ නැළවිලි ගීතය
ලොවම නිවන කවියක් වේවා
",කරුණාරත්න දිවුල්ගනේ,සම්භාව්ය,සුනිල් දයානන්ද කෝනාර,සුනිල් දයානන්ද කෝනාර,"ඒ හිරු එළියේ නැණ මල් පොඩි පිපුණා


","හිරු එළියේ රෝස මල් අග්ගිස් මල් පිපුණා

"
Kohe Ho Numba | කොහේ හෝ නුඹ,"කොහේ හෝ නුඹ නතර වි 
කාට හෝ ජීවිතය දී
තුටින් නම් මට ඒ ඇති
මගේ නොවුනට කම් නැතී නුඹ
මගේ නොවුනට කම් නැතී
උන්න දා අපි අපේ වී නුඹ
දුන්නු සෙනෙහස අරුමැති
ලෝභ නෑ හිත අහිමි දා අද
මමත් දැන් මට හිමි නැතී
නුඹ ළඟත් මතකය ඇතී
නමුදු අපි වෙන් වී ඇතී
එපා රිදවුම් ගන්න දිවියට
අපිට හිමි ජීවිත ඇතී
",කරුණාරත්න දිවුල්ගනේ,නව පොප්,දර්ශන වික්‍රමතුංග,ශමිලා හුසේන්,"


තුටින් නම් මට ඒ ඇති

මගේ නොවුනට කම් නැතී



දුන්නු සෙනෙහස අරුමැති

මමත් දැන් මට හිමි නැතී

නමුදු අපි වෙන් වී ඇතී

එපා රිදවුම් ගන්න දිවියට
","


ඒක මට හොඳටම ඇති

එය මගේ නොවේ නම් එය අදාළ නොවේ



දුන් ආදරය උතුම් ය

මට එය තවදුරටත් අයිති නැත

නමුත් අපි වෙන්වෙලා

ඔබේ ජීවිතය විනාශ නොකරන්න
"
Konda Kirilliye | කොණ්ඩ කිරිල්ලියේ,"කොණ්ඩ කිරිල්ලියේ 
කවුද නුඹේ ප්‍රේමවන්තයා
කොණ්ඩෙ කපනවාද කොණ්ඩෙ බඳිනවාද
කොණ්ඩෙ කපනවාද බඳිනවාද කියාපන් එයා
රංචු ඉලන්දාරි කල්ලි ගැහී බෝවිටියා සොයා
පුංචි කට රතු කර සිංදු එහෙම කියනවාද එයා
පුංචි කට රතු කර සිංදු එහෙම කියනවාද එයා
රංචු ඉලන්දාරි කල්ලි ගැහී බෝවිටියා සොයා
ඔන්න කියන්නෙපා කිරිල්ලියේ නොකිව්වාය කියා
ඔය ලෙන්ගතුකම් බෑ දෑවැදි ඉල්ලුවොතින් එයා
රංචු ඉලන්දාරි කල්ලි ගැහී බෝවිටියා සොයා
පුංචි කට රතු කර සිංදු එහෙම කියනවාද එයා
",කරුණාරත්න දිවුල්ගනේ,නව පොප්,රෝහණ වීරසිංහ,රත්න ශ්‍රී විජේසිංහ,"


කවුද නුඹේ ප්‍රේමවන්තයා

කොණ්ඩෙ කපනවාද බඳිනවාද කියාපන් එයා
","


ඔබේ ආදර සහකරු කවුද?

කොණ්ඩෙ කපන්නද බඳිනවද කියලා එයා දන්නෙ නෑ
"
La Dalu Bo Path | ලා දළු බෝ පත්,"ලා දළු බෝ පත් සෙමින් සැලෙන සේ
යශෝදරා දේවී
වාවනු බැරි තැන රහසේ හැඬුවා
පෙර සංසාරේ ඇසුර මතක් වී
ලා දළු බෝ පත් සෙමින් සැලෙන සේ
ලේන කුලේ සිට ආගිය මඟ තොට
සිටියා නොසැලෙන පහන් ටැඹක් වී
නිවන් දකින තුරු මේ සංසාරේ
පසු පස ආවා සෙවනැල්ලක් වී
තැලී සෙනේ සිත සැලී හඬන විට
වැටී දෙපා ලඟ යශෝදරාවෝ
පිපී නිවන් මල් සාධුකාර දී
නිවී පහන් විය උදෑසනක් සේ
",කරුණාරත්න දිවුල්ගනේ,සම්භාව්ය,එච්.එම් ජයවර්ධන,රඹුක්කන සිද්ධාර්ථ හිමි,"ලා දළු බෝ පත් සෙමින් සැලෙන සේ
වාවනු බැරි තැන රහසේ හැඬුවා","සැහැල්ලු කොළ සෙමින් පැද්දෙමින් තිබේ
මට නොපෙනෙන තැන මම රහසින් ඇඬුවෙමි"
Ma Obath Ekka | මා ඔබත් එක්ක ,"මා ඔබත් එක්ක සුහද කතාවක්
ඔබෙ ඇසුත් එක්ක ප්‍රේම කතාවක්
තොරතුරු විමසනවා ආගිය තැන් පවසනවා
තොරතුරු විමසනවා ආගිය තැන් පවසනවා
සංසාරේ හුරුපුරුදුයි කියල කියනවා
කියල කියනවා
මා ඔබත් එක්ක දිගට කතාවක්
ඔබෙ ඇසුත් එක්ක ප්‍රේම කතාවක්
රස රහස් කියනවා විටකදි ඉගිත් කරනවා
රස රහස් කියනවා විටකදි ඉගිත් කරනවා
ඇවිදින්නට තනිවෙන්නට යමුද අහනවා
යමුද අහනවා
සද හිරුත් එක්ක හොරෙන් කතාවක්
තරු මාත් එක්ක ප්‍රේම කතාවක්
වරදක් නැහැ කියනා කවුරුත් නොම එයි සිතනා
වරදක් නැහැ කියනා කවුරුත් නොම එයි සිතනා
සිත ගන්නට ළං වෙන්නට එන්න අහනවා
එන්න අහනවා
",කරුණාරත්න දිවුල්ගනේ,නව පොප්,රෝහණ වීරසිංහ,ලලිත් ද සිල්වා,"
ඔබෙ ඇසුත් එක්ක ප්‍රේම කතාවක්

වරදක් නැහැ කියනා කවුරුත් නොම එයි සිතනා
","
ඔබට සවන් දිය හැකි ආදර කතාවක්

මම හිතන්නේ නෑ කවුරුත් මේකේ වැරදි දෙයක් කියයි කියලා
"
Mage Duwe Oba – මගෙ දුවේ ඔබ,"මගෙ දුවේ ඔබ අවදියෙන් නම්
මේ රැයේ මිහිරිම වෙලාවයි
දොර ඇරන් එළියට ආවොතින්
මේ මිහිරි දේවල් නුඹටමයි
සේපාලිකා මල් බිමට බැහැලා
ඇවිදින්න යන වෙලාවයි
නිල් තාරුකා බිම බලාගෙන
වැව් දියට පෙම් බැඳි වෙලාවයි
මේ පොළව කොතරම් සුන්දරද
මගේ දූ තනියම හිනාවෙයි
ගණ කළුවරට අප පෙම් කලොත්
ඉර හඳ තරුවනට ණය ගැතියි
ලොව දුන්නු දේවල් අද අපිට හෙට
ලොවට පෙරලා දිය යුතුයි
ඔබ මේ ලොවට ආදරෙයි නම්
මුළු ලොවම ඔබටත් ආදරෙයි
",කරුණාරත්න දිවුල්ගනේ,සම්භාව්ය,රෝහණ වීරසිංහ,රත්න ශ්‍රී විජේසිංහ,"ලොව දුන්නු දේවල් අද අපිට හෙට
","අද ලෝකය අපට දී ඇති දේ හෙට නැවත පැමිණෙනු ඇත
"
Mala Giraviye | මාල ගිරවියේ ,"මාල ගිරවියේ ... මාල ගිරවියේ
මට නුඹත් එක්ක අපේ ගමට පියාඹන්න ආසයි
මං දන්න කියන ගහකොල මල් පෙන්නන්නට ආසයි
මාල ගිරවියේ... මාල ගිරවියේ
දුර නෑයො පවා ගේ දොරකඩ එකතුවෙලා හිදිවි
නුඹේ මාලෙ හැබෑ රත්තරන්ද අත ගලා බලාවි
මේ සේද ඇදුම් ඉල්ල ගත්තේ කාගෙන්දැයි අසාවි
මගෙ උර තලයේ හිස තියාන හෙමිහිට ඉකි බිදිවි
අපෙ නැති බැරිකම් ඒ තරමට අමිහිරිදැයි අසාවි
ඒනිසා තවත් ටික දවසක් ඉවසමු අපි කුමාරි
",කරුණාරත්න දිවුල්ගනේ,නව පොප්,එච්.එම් ජයවර්ධන,රත්න ශ්‍රී විජේසිංහ,"මට නුඹත් එක්ක අපේ ගමට පියාඹන්න ආසයි

මං දන්න කියන ගහකොල මල් පෙන්නන්නට ආසයි

මේ සේද ඇදුම් ඉල්ල ගත්තේ කාගෙන්දැයි අසාවි
","මට ඔයාව අපේ ගමට එක්කන් යන්න ඕන

මම දන්න පැල සහ මල් පෙන්නන්න කැමතියි

මේ සේද ඇඳුම් ඉල්ලන්නේ කාගෙන්දැයි ඔහු අසයි
"
Obata Waram Nathi | ඔබට වරම් නැති ,"ඔබට වරම් නැති මටද වරම් නැති
සෙනෙහස කොතැනද සැඟව ගියේ
ඉවත ගලා ගිය කඳුලක දියවී
ප්‍රථම ප්‍රේමයයි බොඳව ගියේ
ඔහුට පුදන්නට පූජාසනයේ
නොකිලිටි මල් පිපුනිද ලඳුනේ..
පෙති ගිලිහී ගිය පරසතු කුසුමක
සුවඳ කොහේ කොතැනද රැදුනේ
ආ මඟ වැරදී ඔහුද ඔබද මා
දෛවයේ තුන්මංසල හමුවී
බලා හිඳිනු මිස හඬා වැටෙන්නට
කඳුලක් නැ දෙනුවන පිපුනේ
",කරුණාරත්න දිවුල්ගනේ,සම්භාව්ය,නාලක අංජන කුමාර,රංජිත් රූපසිංහ,"ප්‍රථම ප්‍රේමයයි බොඳව ගියේ



","පළමු ආදරය නැතිවිය




"
Paya Nagee Evi | Sepalika | පායා නැගී ඒවි | සේපාලිකා ,"පායා නැගී ඒවි රන් තාරාකා
මා හා සිනාවෙන්නේ නෑ ආදරෙන්
දේදුන්න සේ ඈ මැකී වෙන්වෙලා
නාඩා ඉතින් ඉන්න සේපාලිකා
සේපාලිකා…සේපාලිකා
දෙනුවන් වැසී ඈත තරු නෙත් මැකී
තනිව හඬනා ‍රැයේ හදට දී වේදනා
එක් වී ළඟින් ඉන්න ලංවී සිනාසෙන්න
දුර ඈත සිට එන්න සේපාලිකා
සේපාලිකා...සේපාලිකා
රෑ මීදුමේ ගිලුණු තරුමල් ලෙසේ
ඔබේ නෙත් පහන් දැල්වුනේ හදට දී වේදනා
කඳුල පිසලන්න සතුට තවරන්න 
සුළඟක් ලෙසින් එන්න සේපාලිකා 
සේපාලිකා..සේපාලිකා
",කරුණාරත්න දිවුල්ගනේ,නව පොප්,සිරිල් පෙරේරා,උබේනන්ද දිසානායක,"ඔබේ නෙත් පහන් දැල්වුනේ හදට දී වේදනා


","ඔබේ ඇස් වේදනාවෙන් බැබළුණා


"
Pem Kawak Liyu | පෙම් කවක් ලියූ,"පෙම් කවක් ලියූ නුඹ සිත් අහසේ 
එය මකා දමා ගිය හැටි රහසේ
නුඹ මෙතෙක් රැදී උන් මා මනසේ
පෙම් පුරාවතක්.. නිමා කරන්නද මා කෙලෙසේ
නුඹ යන්නම යන්නම යනවානම්
මට ඉන්න කියන්නට බැහැනෙ ඉතින්
යලි එන්නනම එන්නම හිතුනේ නම්
නුඹ එන්න එපා මගෙ හිත තහනම්
හුරතලෙන් දැවටිලා මගේ ලඟින්
දුන් සතුට එපමණද මට පවසම්
සඳ එලිය පොළොවටයි හිමිවූයේ
සඳ අහසෙ රැදුනාට රත්තරනේ
",කරුණාරත්න දිවුල්ගනේ,නව පොප්,නන්දසේන කටුවල,මනරම් මාපිටිය,"පෙම් පුරාවතක්.. නිමා කරන්නද මා කෙලෙසේ








","ආදර කතාව අවසන් කිරීමට හොඳම ක්‍රමය මට කියන්න?







"
Premaye Mandahasini | ප්‍රේමයේ මන්දහාසිනී ,"ප්‍රේමයේ මන්දහාසිනී යෞවනේ සිහින සාධනී
නීල නයන නිල් දියේ සීත නලින නිම්නයේ
පාව යයි සුන්දරයි ජීවිතේ
ප්‍රේමයේ මන්දහාසිනී
තාරකා නිව දමන්න නෙත් කැලුම් විදා
මා සිතේ විඩා නිවන්න පෙම් පවන් සලා
සඳත් වසන් වෙලා රැයක් මුදුන් කලා
පාව යයි සුන්දරයි ජීවිතේ
මාලතී වනේ රැඳෙම්ද මල් යහන් තලා
මී විතේ අමා පුරම්ද රත් ලවන් පෙලා
සුසුම් පවන් ගලා හැඟුම් දියත් කලා
පාව යයි සුන්දරයි ජීවිතේ
",කරුණාරත්න දිවුල්ගනේ,නව පොප්,රෝහණ වීරසිංහ,කුලරත්න ආරියවංශ,"
ප්‍රේමයේ මන්දහාසිනී යෞවනේ සිහින සාධනී
","
ආදරය යෞවනයේ සිහින සැබෑ වේ
"
